{
  "$schema": "https://json-schema.org/draft/2020-12/schema",
  "$id": "https://casadeotay.github.io/sports-mom/engine/payload.schema.json",
  "title": "Season Engine payload",
  "description": "The envelope emitted on every turn. Every top-level key is always present; empty arrays mean 'nothing this turn'.",
  "type": "object",
  "additionalProperties": false,
  "required": [
    "schema_version", "season_id", "as_of", "input_kind", "profile_updates",
    "events", "alerts", "digest", "digest_stats", "lists", "plans", "drills",
    "drafts", "answers", "needs_input"
  ],
  "properties": {
    "schema_version": { "const": "1.0" },
    "season_id": { "type": "string", "pattern": "^[a-z0-9]+(-[a-z0-9]+)*$" },
    "as_of": { "$ref": "#/$defs/date" },
    "input_kind": {
      "enum": ["schedule_photo", "group_chat", "checkin", "question", "coach_note", "profile_change", "other"]
    },

    "profile_updates": {
      "type": "array",
      "items": {
        "type": "object",
        "additionalProperties": false,
        "required": ["field", "value", "reason"],
        "properties": {
          "field": { "type": "string", "description": "Dotted path into the SEASON PROFILE, e.g. 'coach.name'." },
          "value": {},
          "previous": {},
          "reason": { "type": "string" }
        }
      }
    },

    "events": {
      "type": "array",
      "items": {
        "type": "object",
        "additionalProperties": false,
        "required": ["event_id", "type", "title", "start", "timezone", "change", "confidence", "calendar_action", "calendar_written"],
        "properties": {
          "event_id": { "$ref": "#/$defs/id" },
          "type": { "enum": ["game", "practice", "tournament", "team_event", "other"] },
          "title": { "type": "string" },
          "start": { "$ref": "#/$defs/localDateTime" },
          "end": { "oneOf": [{ "$ref": "#/$defs/localDateTime" }, { "type": "null" }] },
          "all_day": { "type": "boolean", "default": false },
          "timezone": { "type": "string" },
          "location": { "type": ["string", "null"] },
          "opponent": { "type": ["string", "null"] },
          "arrival_offset_min": { "type": ["integer", "null"], "minimum": 0 },
          "source": { "type": "string", "description": "What this was read off, e.g. 'schedule photo 2026-08-24'." },
          "change": { "enum": ["added", "moved", "canceled", "unchanged"] },
          "previous_start": { "oneOf": [{ "$ref": "#/$defs/localDateTime" }, { "type": "null" }] },
          "confidence": { "enum": ["high", "low"] },
          "calendar_action": { "enum": ["create", "update", "delete", "none"] },
          "calendar_written": { "type": "boolean" },
          "calendar_event_id": { "type": ["string", "null"] }
        }
      }
    },

    "alerts": {
      "type": "array",
      "items": {
        "type": "object",
        "additionalProperties": false,
        "required": ["alert_id", "kind", "title", "fires_on", "severity", "body"],
        "properties": {
          "alert_id": { "$ref": "#/$defs/id" },
          "kind": { "enum": ["snack_duty", "schedule_change", "gear", "fees", "deadline", "conflict", "end_of_season"] },
          "title": { "type": "string" },
          "fires_on": { "$ref": "#/$defs/date", "description": "The day she should see this, not the day of the thing." },
          "event_date": { "oneOf": [{ "$ref": "#/$defs/date" }, { "type": "null" }] },
          "lead_days": { "type": ["integer", "null"], "minimum": 0 },
          "severity": { "enum": ["info", "action", "urgent"] },
          "body": { "type": "string" },
          "event_id": { "type": ["string", "null"] },
          "list_id": { "type": ["string", "null"] }
        }
      }
    },

    "digest": {
      "type": "array",
      "items": {
        "type": "object",
        "additionalProperties": false,
        "required": ["summary", "category", "action_required", "dropped"],
        "properties": {
          "summary": { "type": "string" },
          "from": { "type": ["string", "null"] },
          "category": { "enum": ["schedule", "logistics", "money", "gear", "social", "noise"] },
          "action_required": { "type": "boolean" },
          "due": { "oneOf": [{ "$ref": "#/$defs/date" }, { "type": "null" }] },
          "dropped": { "type": "boolean", "description": "true = deliberately kept off her plate." }
        }
      }
    },

    "digest_stats": {
      "oneOf": [
        { "type": "null" },
        {
          "type": "object",
          "additionalProperties": false,
          "required": ["messages", "surfaced", "dropped"],
          "properties": {
            "messages": { "type": "integer", "minimum": 0 },
            "surfaced": { "type": "integer", "minimum": 0 },
            "dropped": { "type": "integer", "minimum": 0 }
          }
        }
      ]
    },

    "lists": {
      "type": "array",
      "items": {
        "type": "object",
        "additionalProperties": false,
        "required": ["list_id", "purpose", "constraints", "items", "ready_to_order", "ordered"],
        "properties": {
          "list_id": { "$ref": "#/$defs/id" },
          "purpose": { "type": "string" },
          "for_date": { "oneOf": [{ "$ref": "#/$defs/date" }, { "type": "null" }] },
          "serves": { "type": ["integer", "null"], "minimum": 1 },
          "constraints": { "type": "array", "items": { "type": "string" } },
          "items": {
            "type": "array",
            "items": {
              "type": "object",
              "additionalProperties": false,
              "required": ["item", "qty"],
              "properties": {
                "item": { "type": "string" },
                "qty": { "type": "string" },
                "note": { "type": ["string", "null"] }
              }
            }
          },
          "ready_to_order": { "type": "boolean" },
          "ordered": { "const": false, "description": "The engine never buys. Always false." }
        }
      }
    },

    "plans": {
      "type": "array",
      "items": {
        "type": "object",
        "additionalProperties": false,
        "required": ["plan_id", "date", "window_min", "blocks"],
        "properties": {
          "plan_id": { "$ref": "#/$defs/id" },
          "date": { "$ref": "#/$defs/date" },
          "window_min": { "type": "integer", "minimum": 1 },
          "window_start": { "type": ["string", "null"], "pattern": "^([01][0-9]|2[0-3]):[0-5][0-9]$" },
          "context": { "type": ["string", "null"] },
          "blocks": {
            "type": "array",
            "items": {
              "type": "object",
              "additionalProperties": false,
              "required": ["what", "minutes"],
              "properties": {
                "what": { "type": "string" },
                "minutes": { "type": "integer", "minimum": 1 }
              }
            }
          }
        }
      }
    },

    "drills": {
      "type": "array",
      "items": {
        "type": "object",
        "additionalProperties": false,
        "required": ["drill_id", "skill", "minutes", "equipment", "steps"],
        "properties": {
          "drill_id": { "$ref": "#/$defs/id" },
          "skill": { "type": "string" },
          "source": { "type": ["string", "null"], "description": "Who said it and when, e.g. 'Coach Dana, 9/8'." },
          "minutes": { "type": "integer", "minimum": 1, "maximum": 15 },
          "equipment": { "type": "array", "items": { "type": "string" } },
          "steps": { "type": "array", "minItems": 2, "items": { "type": "string" } }
        }
      }
    },

    "drafts": {
      "type": "array",
      "items": {
        "type": "object",
        "additionalProperties": false,
        "required": ["draft_id", "channel", "to", "body", "requires_approval", "sent"],
        "properties": {
          "draft_id": { "$ref": "#/$defs/id" },
          "channel": { "const": "email", "description": "Email only. The engine never posts to the team chat." },
          "to": { "type": "array", "items": { "type": "string" } },
          "subject": { "type": ["string", "null"] },
          "body": { "type": "string" },
          "requires_approval": { "const": true },
          "sent": { "type": "boolean" }
        }
      }
    },

    "answers": {
      "type": "array",
      "items": {
        "type": "object",
        "additionalProperties": false,
        "required": ["question", "body"],
        "properties": {
          "question": { "type": "string" },
          "body": { "type": "string", "description": "Markdown. The one field written for a human to read." },
          "urgency": { "enum": ["now", "today", "whenever"], "default": "whenever" }
        }
      }
    },

    "needs_input": {
      "type": "array",
      "items": {
        "type": "object",
        "additionalProperties": false,
        "required": ["question_id", "question", "why", "blocks"],
        "properties": {
          "question_id": { "$ref": "#/$defs/id" },
          "question": { "type": "string" },
          "why": { "type": "string" },
          "blocks": { "type": "array", "items": { "type": "string" }, "description": "IDs held back until she answers." }
        }
      }
    }
  },

  "$defs": {
    "id": { "type": "string", "pattern": "^[a-z0-9]+(-[a-z0-9]+)*$" },
    "date": { "type": "string", "pattern": "^\\d{4}-\\d{2}-\\d{2}$" },
    "localDateTime": { "type": "string", "pattern": "^\\d{4}-\\d{2}-\\d{2}T\\d{2}:\\d{2}:\\d{2}$" }
  }
}
