{
  "schema_version": "1.0",
  "season_id": "marcus-fall-soccer",
  "as_of": "2026-10-02",
  "input_kind": "question",
  "profile_updates": [],
  "events": [],
  "alerts": [],
  "digest": [],
  "digest_stats": null,
  "lists": [],
  "plans": [],
  "drills": [],
  "drafts": [],
  "answers": [
    {
      "question": "Grass stain down the front of the white jersey, game is at 9am tomorrow.",
      "body": "White polyester, so you have time — the stain is pigment sitting on the fibers, not soaked into them like cotton.\n\n1. **Cold water only.** Hot water sets a grass stain into polyester permanently. Rinse the back of the stain under cold to push pigment out the way it came in.\n2. **Rubbing alcohol on the green.** Dab, don't rub, with a white cloth or cotton ball. Test an inside seam first. The chlorophyll lifts into the alcohol — keep moving to a clean part of the cloth.\n3. **Work in liquid enzyme detergent** (Tide, Persil — anything that says \"enzymes\"), right onto the stain with your fingers. Let it sit 15 minutes.\n4. **Wash warm, not hot**, on a normal cycle.\n5. **Air dry.** The dryer sets whatever is left. If a shadow remains, repeat from step 3 — you still have tonight.\n\nSkip chlorine bleach. It yellows white polyester and you'll be more upset about that than the stain."
    }
  ],
  "needs_input": []
}
